{
  "$schema": "https://lumicorp.github.io/ruhroh/schemas/publish-check-v2.schema.json",
  "version": "ruhroh_publish_check_v2",
  "source": {
    "resultsPath": "./results",
    "suiteId": "economics-smoke-example",
    "runPlanPath": "./ruhroh-run-plan.json"
  },
  "publishable": false,
  "blockerCount": 1,
  "blockers": [
    "artifact-completeness warnings present"
  ],
  "remediation": [
    {
      "code": "artifact_evidence_incomplete",
      "category": "artifacts",
      "severity": "blocker",
      "blocker": "artifact-completeness warnings present",
      "action": "Run validate-artifacts on the result root and repair missing or inconsistent run evidence before publishing.",
      "docs": "artifacts#validate-artifacts"
    }
  ],
  "advisoryCount": 1,
  "advisories": [
    "Experimental economics fixture; live Kestrel conformance is not represented."
  ],
  "compare": {
    "$schema": "https://lumicorp.github.io/ruhroh/schemas/compare-v2.schema.json",
    "version": "ruhroh_compare_v2",
    "createdAt": "2026-08-12T12:00:00.000Z",
    "groups": [
      {
        "scenarioId": "simple-newsletter",
        "benchmarkTargetId": "baseline-target",
        "executionAdapterIds": [
          "fixture-agent"
        ],
        "adapter": "baseline-target",
        "cohort": {
          "sampleIds": [
            "baseline-1",
            "baseline-10",
            "baseline-2",
            "baseline-3",
            "baseline-4",
            "baseline-5",
            "baseline-6",
            "baseline-7",
            "baseline-8",
            "baseline-9"
          ],
          "sampleSeeds": [
            "baseline-1",
            "baseline-10",
            "baseline-2",
            "baseline-3",
            "baseline-4",
            "baseline-5",
            "baseline-6",
            "baseline-7",
            "baseline-8",
            "baseline-9"
          ],
          "scenarioVersions": [
            "1.0.0"
          ],
          "adapterVersions": [
            "1.0.0"
          ],
          "executionAdapterIds": [
            "fixture-agent"
          ],
          "benchmarkStreams": [
            "model-controlled"
          ],
          "benchmarkTargets": [
            "baseline-target"
          ],
          "harnesses": [
            "unknown"
          ],
          "providerPaths": [
            "unknown"
          ],
          "agentModels": [
            "fixture/baseline-target"
          ],
          "agentCanonicalModels": [
            "fixture/baseline-target"
          ],
          "agentPromptVersions": [
            "1.0.0"
          ],
          "evaluatorModels": [
            "fixture/judge"
          ],
          "evaluatorPromptVersions": [
            "1.0.0"
          ],
          "evaluatorInputSignatures": [
            "context=1;rubric=1;evidence=1;calibration=1;privateAssets=0;privateAssetPathHashes=none"
          ],
          "judgeIdentities": [
            "fixture@1.0.0"
          ],
          "environmentFingerprints": [
            "sha256:aaaaaaaaaaaaaaaaaaaaaaaaaaaaaaaaaaaaaaaaaaaaaaaaaaaaaaaaaaaaaaaa"
          ],
          "effectiveBudgetHashes": [
            "bbbbbbbbbbbbbbbbbbbbbbbbbbbbbbbbbbbbbbbbbbbbbbbbbbbbbbbbbbbbbbbb"
          ],
          "effectiveCapabilitiesHashes": [
            "cccccccccccccccccccccccccccccccccccccccccccccccccccccccccccccccc"
          ],
          "comparabilityWarnings": [
            "missing harness metadata in aggregate group",
            "missing provider path metadata in aggregate group"
          ]
        },
        "runs": 10,
        "passes": 10,
        "passRate": 1,
        "passRateCi95": {
          "method": "wilson",
          "confidenceLevel": 0.95,
          "lower": 0.7224672001371106,
          "upper": 0.9999999999999999
        },
        "passAtK": {
          "pass@1": 1,
          "pass@2": 1,
          "pass@3": 1,
          "pass@4": 1,
          "pass@5": 1
        },
        "meanScore": 1,
        "meanScoreCi95": {
          "method": "bootstrap_percentile",
          "confidenceLevel": 0.95,
          "lower": 1,
          "upper": 1
        },
        "meanSubscores": {},
        "medianDurationMs": 120450,
        "iterationDistribution": {
          "1": 10
        },
        "failureBuckets": {
          "none": 10
        },
        "reviewRequired": 0,
        "evalQualityWarnings": {},
        "artifactCompletenessWarnings": {
          "missing artifact path: runManifest": 10,
          "missing artifact path: implementationRuns": 10,
          "missing artifact path: journey": 10,
          "missing artifact path: evalResult": 10,
          "missing artifact path: evalInput": 10,
          "missing artifact path: workspaceSummary": 10,
          "missing artifact path: workspaceTarball": 10,
          "missing artifact path: eventsTarball": 10,
          "missing artifact path: transcriptsTarball": 10
        },
        "acceptedOutcomeInvariantWarnings": {},
        "usage": {
          "runsWithUsage": 10,
          "runsWithCost": 0,
          "runsWithTokens": 10,
          "coverage": {
            "cost": {
              "status": "unknown",
              "observedRuns": 0,
              "completeRuns": 0,
              "totalRuns": 10
            },
            "totalTokens": {
              "status": "complete",
              "observedRuns": 10,
              "completeRuns": 10,
              "totalRuns": 10
            }
          },
          "totalTokens": 20450,
          "meanTotalTokens": 2045,
          "tokensPerPass": 2045,
          "tokensPerAcceptedOutcome": 2045
        },
        "statisticalWarnings": [
          "missing harness metadata in aggregate group",
          "missing provider path metadata in aggregate group"
        ]
      },
      {
        "scenarioId": "simple-newsletter",
        "benchmarkTargetId": "efficient-target",
        "executionAdapterIds": [
          "fixture-agent"
        ],
        "adapter": "efficient-target",
        "cohort": {
          "sampleIds": [
            "efficient-1",
            "efficient-10",
            "efficient-2",
            "efficient-3",
            "efficient-4",
            "efficient-5",
            "efficient-6",
            "efficient-7",
            "efficient-8",
            "efficient-9"
          ],
          "sampleSeeds": [
            "efficient-1",
            "efficient-10",
            "efficient-2",
            "efficient-3",
            "efficient-4",
            "efficient-5",
            "efficient-6",
            "efficient-7",
            "efficient-8",
            "efficient-9"
          ],
          "scenarioVersions": [
            "1.0.0"
          ],
          "adapterVersions": [
            "1.0.0"
          ],
          "executionAdapterIds": [
            "fixture-agent"
          ],
          "benchmarkStreams": [
            "model-controlled"
          ],
          "benchmarkTargets": [
            "efficient-target"
          ],
          "harnesses": [
            "unknown"
          ],
          "providerPaths": [
            "unknown"
          ],
          "agentModels": [
            "fixture/efficient-target"
          ],
          "agentCanonicalModels": [
            "fixture/efficient-target"
          ],
          "agentPromptVersions": [
            "1.0.0"
          ],
          "evaluatorModels": [
            "fixture/judge"
          ],
          "evaluatorPromptVersions": [
            "1.0.0"
          ],
          "evaluatorInputSignatures": [
            "context=1;rubric=1;evidence=1;calibration=1;privateAssets=0;privateAssetPathHashes=none"
          ],
          "judgeIdentities": [
            "fixture@1.0.0"
          ],
          "environmentFingerprints": [
            "sha256:aaaaaaaaaaaaaaaaaaaaaaaaaaaaaaaaaaaaaaaaaaaaaaaaaaaaaaaaaaaaaaaa"
          ],
          "effectiveBudgetHashes": [
            "bbbbbbbbbbbbbbbbbbbbbbbbbbbbbbbbbbbbbbbbbbbbbbbbbbbbbbbbbbbbbbbb"
          ],
          "effectiveCapabilitiesHashes": [
            "cccccccccccccccccccccccccccccccccccccccccccccccccccccccccccccccc"
          ],
          "comparabilityWarnings": [
            "missing harness metadata in aggregate group",
            "missing provider path metadata in aggregate group"
          ]
        },
        "runs": 10,
        "passes": 10,
        "passRate": 1,
        "passRateCi95": {
          "method": "wilson",
          "confidenceLevel": 0.95,
          "lower": 0.7224672001371106,
          "upper": 0.9999999999999999
        },
        "passAtK": {
          "pass@1": 1,
          "pass@2": 1,
          "pass@3": 1,
          "pass@4": 1,
          "pass@5": 1
        },
        "meanScore": 1,
        "meanScoreCi95": {
          "method": "bootstrap_percentile",
          "confidenceLevel": 0.95,
          "lower": 1,
          "upper": 1
        },
        "meanSubscores": {},
        "medianDurationMs": 90450,
        "iterationDistribution": {
          "1": 10
        },
        "failureBuckets": {
          "none": 10
        },
        "reviewRequired": 0,
        "evalQualityWarnings": {},
        "artifactCompletenessWarnings": {
          "missing artifact path: runManifest": 10,
          "missing artifact path: implementationRuns": 10,
          "missing artifact path: journey": 10,
          "missing artifact path: evalResult": 10,
          "missing artifact path: evalInput": 10,
          "missing artifact path: workspaceSummary": 10,
          "missing artifact path: workspaceTarball": 10,
          "missing artifact path: eventsTarball": 10,
          "missing artifact path: transcriptsTarball": 10
        },
        "acceptedOutcomeInvariantWarnings": {},
        "usage": {
          "runsWithUsage": 10,
          "runsWithCost": 0,
          "runsWithTokens": 10,
          "coverage": {
            "cost": {
              "status": "unknown",
              "observedRuns": 0,
              "completeRuns": 0,